{
  "company_id": "wsc-lat",
  "name": "WS Capital",
  "business_mode": "existing",
  "primary_country": "MX",
  "primary_region": "Latinoamerica",
  "currency_code": "USD",
  "industry": "AI lab and venture capital hybrid",
  "website": "https://wsc.lat/",
  "seed_summary": "Firma que se presenta como AI Lab y Venture Capital Hybrid para Latinoamerica, con foco en infraestructura agentic e inteligencia abierta.",
  "current_state_summary": "",
  "known_constraints": [
    "Solo se usa la web publica como fuente inicial.",
    "No hay entrevistas, pricing interno ni evidencia operativa privada."
  ],
  "tone_constraints": [],
  "forbidden_phrases": [],
  "status": "needs_validation",
  "confidence": 0.87,
  "source_origin": "user_seed",
  "evidence_refs": [
    "2026-03-18-wsc-positioning-hybrid",
    "2026-03-18-wsc-problem-latam",
    "2026-03-18-wsc-agentic-ratio",
    "2026-03-18-wsc-open-intel-platform",
    "2026-03-18-wsc-ai-lab-offer",
    "2026-03-18-wsc-active-units"
  ],
  "source_refs": [],
  "notes": "Fuente inicial unica: sitio publico wsc.lat capturado el 2026-03-18.",
  "created_at": "2026-03-18T20:11:01",
  "updated_at": "2026-03-18T20:11:01"
}
