{
  "company_id": "public-case-real-estate-studio",
  "name": "Luma Preventa Studio",
  "business_mode": "existing",
  "primary_country": "MX",
  "primary_region": "Ciudad de Mexico",
  "currency_code": "MXN",
  "industry": "Preventa inmobiliaria visual para desarrolladoras residenciales boutique",
  "website": "",
  "seed_summary": "Estudio que arma renders, video corto, recorrido 360 y landing de preventa para desarrolladoras residenciales boutique que necesitan vender antes de terminar obra.",
  "current_state_summary": "",
  "known_constraints": [],
  "tone_constraints": [
    "claro",
    "concreto",
    "sobrio",
    "visual pero no inflado"
  ],
  "forbidden_phrases": [
    "experiencia inmersiva de lujo",
    "solucion 360 integral",
    "lleva tu desarrollo al siguiente nivel"
  ],
  "status": "validated",
  "confidence": 0.95,
  "source_origin": "existing_folder_seed",
  "evidence_refs": [
    "2026-03-18-preventa-necesita-material-que-si-venda",
    "2026-03-18-cambios-de-proyecto-rompen-las-piezas",
    "2026-03-18-tour-360-filtra-visitas",
    "2026-03-18-confianza-remota-antes-del-showroom",
    "2026-03-18-buyer-quiere-paquete-unificado",
    "2026-03-18-objecion-sobre-alcance-y-rondas",
    "2026-03-18-el-material-debe-servir-para-whatsapp"
  ],
  "source_refs": [],
  "notes": "Caso compuesto basado en referencias publicas de Matterport Mexico, Shot 360 y Tour 360, mas notas sinteticas de ventas y objeciones de desarrolladoras residenciales boutique.",
  "created_at": "2026-03-18T17:07:09",
  "updated_at": "2026-03-18T17:07:09",
  "workspace_mode": "in_place_business_folder"
}
